{"work_id":"뉴하트_08","scene_count":47,"core_dist":{"RESCUE":1,"BOND":11,"ROMANCE":7,"DESIRE":6,"ESTABLISH":2,"CONFLICT":16,"PERIL":3,"REVELATION":4,"LOSS":2,"REVERSAL":2,"PUNISH":3,"ORACLE":1,"HOOK":1},"episode_function":"오프 여정에서 싹튼 은성·혜석의 감정이 깊어지는 동시에, 최강국이 불치 판정 심장종양 환자 수술을 공개 선언하며 병원 권력과 정면충돌하는 두 축이 수렴하는 회차.","by":"sonnet_reading"}
