{"work_id": "태양의후예_07", "scene_count": 46, "core_dist": {"PERIL": 9, "LOSS": 9, "RELIEF": 7, "CONFLICT": 5, "RESCUE": 4, "BOND": 4, "ROMANCE": 3, "ESTABLISH": 2, "REVERSAL": 1, "REVELATION": 1, "DESIRE": 1}, "episode_function": "우르크 대지진 발전소 붕괴현장에서 하루 동안 벌어지는 총력 구조작전을 중심으로, 모연이 시진의 강요로 두 생존자 중 한 명만 살려야 하는 잔혹한 선택을 내리고 그 대가로 고반장을 잃는 트롤리 딜레마가 에피소드의 축을 이룬다. 낮의 사투와 상실을 밤의 애도·유머·로맨스로 수습하며 대영-명주, 시진-모연 두 커플의 감정이 한 걸음씩 깊어지는 것으로 마무리된다.", "by": "sonnet_reading"}
