{
  "work_id": "공주가돌아왔다_08",
  "scene_count": 63,
  "core_dist": {
    "BOND": 8,
    "CONFLICT": 17,
    "DESIRE": 12,
    "ESTABLISH": 3,
    "HOOK": 11,
    "INTRO": 1,
    "LOSS": 9,
    "ORACLE": 10,
    "PERIL": 3,
    "PUNISH": 12,
    "RELIEF": 12,
    "RESCUE": 2,
    "REUNION": 2,
    "REVELATION": 9,
    "REVERSAL": 5,
    "ROMANCE": 10
  },
  "episode_function": "도경의 능동적 방해와 찬우의 공모를 통해 삼각관계를 비밀 게임으로 심화하고, 마지막 사진으로 공심에게 첫사랑의 정체를 확정 폭로한다.",
  "by": "gpt-5.6-direct-reading-repair-v2"
}
