{
  "work_id": "밀회_03",
  "scene_count": 90,
  "core_dist": {
    "PERIL": 14,
    "BOND": 6,
    "RELIEF": 8,
    "CONFLICT": 10,
    "DESIRE": 11,
    "HOOK": 5,
    "ESTABLISH": 17,
    "ROMANCE": 3,
    "REVELATION": 7,
    "LOSS": 7,
    "PUNISH": 2
  },
  "episode_function": "혜원과 선재 사이 은밀한 감정 교류가 커지는 동안, 준형의 입시 비리와 재단의 계산이 병렬로 심화되고, 다미의 거짓말발 사고로 명화가 급사하며 선재의 시험이 실격되고 인생이 전복된다. 상실 이후 공익 복무기를 거쳐 돌아온 선재가 혜원에게 고백하며 다음 국면(불륜의 실체적 시작)을 여는 강력한 클리프행어로 마무리.",
  "by": "cowork opus authoring"
}