{"work_id": "카인과아벨_19", "scene_count": 55, "core_dist": {"REVELATION": 6, "PERIL": 12, "CONFLICT": 14, "ESTABLISH": 2, "ROMANCE": 5, "RELIEF": 1, "BOND": 2, "HOOK": 5, "LOSS": 4, "REVERSAL": 1, "RESCUE": 2, "REUNION": 1}, "episode_function": "초인이 선우의 뇌종양을 발견하며 형제의 원한과 병세가 정면충돌하고, 선우는 윤리위 제소·신경외과 항명·발작 위기 속에서 몰락하다가 서연의 구조로 초인 앞에 무릎 꿇듯 수술을 맡기지만, 초인은 끝내 냉정히 외면하며 응급 상황 속 '죽어버리라'는 냉랭한 엔딩으로 20화 클라이맥스를 예고한다.", "by": "sonnet_reading"}
