{"work_id": "모래시계_12", "scene_count": 57, "core_dist": {"ESTABLISH": 4, "INTRO": 1, "REVELATION": 2, "HOOK": 6, "PERIL": 14, "ORACLE": 8, "DESIRE": 3, "LOSS": 10, "CONFLICT": 2, "RELIEF": 2, "PUNISH": 1, "REUNION": 1, "BOND": 2, "REVERSAL": 1}, "episode_function": "종도가 윤회장 밑에서 이권 조직에 편입되고 장도식이 재접근하는 동안, 태수는 근로봉사대에서 정인재·노주명과 탈출을 감행해 정인재는 희생되고 노주명은 자결하며 태수만 홀로 붙잡혀 독방 처벌 끝에 폐인처럼 풀려난다. 동시에 우석은 위독한 부친을 뵈러 귀향해 사법고시 포기를 선언하고 부친의 임종을 지키며, 두 주인공 모두 회차 말미에 상실과 막막함 속에 놓인다.", "by": "sonnet_reading"}
