{
  "work_id": "내이름은김삼순_06",
  "scene_count": 56,
  "core_dist": {
    "ESTABLISH": 16,
    "HOOK": 18,
    "CONFLICT": 17,
    "DESIRE": 10,
    "REVELATION": 9,
    "RELIEF": 7,
    "BOND": 10,
    "REVERSAL": 5,
    "INTRO": 2,
    "PERIL": 5,
    "LOSS": 5,
    "PUNISH": 2,
    "ROMANCE": 2
  },
  "episode_function": "삼순-희진 두 김희진의 어색한 대면과 홧김 고백(사랑한다는 거짓말)으로 시작해, 헨리의 귀국 예고, 미주와의 놀이치료 베이킹으로 진헌-삼순 유대 심화, 현우의 재접근과 채리 약혼식에서의 복수극(매운 케잌), 마지막 홀 피아노 시퀀스에서 삼순이 먼저 입맞추는 관계 전환까지 이어지는 회차. 삼순-진헌 축의 정서적 유대 강화와 삼순-현우/희진-헨리 과거 정리가 교차 진행되며 극의 무게중심이 계약연애에서 진짜 감정으로 이동한다.",
  "by": "sonnet_reading"
}